dialogue_id,speaker,sentence,classification_typenot-word-found,date-found,figure (number) found,sentiment-type,sentiment-score261,MS. WALKER,walker realize that gs pay is not what we do here on the fprac committee --.,Task Assigned,True,False,False,Negative,1
262,CHAIRMAN FRIEDMAN,that's correct.,Normal,False,False,False,Neutral,2
263,MS. WALKER,-- but it does impact what we have on the floor in front of we right now to decide.,Task Assigned,False,True,False,Positive,3
264,MS. WALKER,"so, if we could possibly get -- and ms.",Normal,False,False,False,Neutral,2
264,MS. WALKER,"walker'm assuming that that information is open to the public, since public funds are paying the bill -- how we came to that decision, the gs employees from monroe county to new york?.",Interrogative-unknown,False,True,False,Neutral,2
265,CHAIRMAN FRIEDMAN,"chairman friedman believe if you consult the reports of the federal salary council for whatever the relevant year is, chairman friedman guess the relevant year would be 2004, something like the federal salary council.",Task Assigned,False,True,True,Negative,1
266,CHAIRMAN FRIEDMAN,"that would have the rationale, and that believe the rationale was based on commuting patterns at the time.",Task Assigned,False,False,False,Negative,1
267,MS. SIMON,didn't allan hearne come and give a briefing at some point?.,Interrogative-unknown,False,False,False,Negative,1
268,CHAIRMAN FRIEDMAN,"chairman friedman did, indeed.",Normal,False,False,False,Negative,1
269,MS. SIMON,yeah.,Normal,False,False,False,Positive,3
270,MS. SIMON,maybe it might have been right before you came on.,Task Assigned,False,False,False,Neutral,2
271,MS. WALKER,"no, he didn't cover that.",Normal,True,False,False,Negative,1
272,MS. WALKER,he covered the process of how --.,Normal,False,False,False,Neutral,2
273,MS. SIMON,"well, that's the answer to the question.",Normal,False,False,False,Positive,3
274,MS. WALKER,-- the locality pay is determined.,Normal,False,False,False,Neutral,2
275,MS. SIMON,"well, that's the answer to your's question, because your question's based on census data, and the decennial census of 2000 had commuting data, and that brought monroe county into the -- is monroe county the combined statistical area or the metropolitan statistical area that includes new york city?.",Interrogative-unknown,False,True,True,Negative,1
276,MR. ALLEN,csa.,Normal,False,False,False,Neutral,2
277,MS. SIMON,csa.,Normal,False,False,False,Neutral,2
278,MS. SIMON,it's a combined statistical area.,Normal,False,False,False,Neutral,2
279,MS. SIMON,"and the gs system has adopted a regulation that concludes an entire combined statistical area in one gs locality, so the gs system was sort of automatic in that regard.",Task Assigned,False,False,False,Negative,1
280,MS. WALKER,"well, ms.",Normal,False,False,False,Positive,3
280,MS. WALKER,walker think army would like --.,Normal,False,False,False,Neutral,2
281,CHAIRMAN FRIEDMAN,chairman friedman'm sorry.,Normal,False,False,False,Negative,1
282,CHAIRMAN FRIEDMAN,"chairman friedman don't mean to cut you off in any way, but you can certainly get you's question answered by top experts at opm right around the table here, jerry and mark, who can give you all the history of the federal salary council, and the federal salary council would be the correct body, chairman friedman think, not this one, for any questions about how monroe county came to be redefined to the new york gs locality pay area.",Normal,True,False,False,Negative,1
283,CHAIRMAN FRIEDMAN,you certainly have avenues to raise that there.,Normal,False,False,False,Positive,3
284,MS. WALKER,"and we will do we, because making that kind of a financial decision without the input of the department of defense is probably not a good way to do this based on the information that is in the report that ms.",Task Assigned,True,False,False,Negative,1
284,MS. WALKER,walker just read.,Normal,False,False,False,Neutral,2
285,MS. WALKER,"increasing the salaries will basically cost us twice as much money, because us will be paying the salaries as well as paying higher cost for the work that's done at tobyhanna, so twice as much money's going to be a bigger financial impact on the department of defense.",Suggestion,False,False,False,Negative,1
286,CHAIRMAN FRIEDMAN,"in other words, the white collar people already had a pay boost that you don't agree with, and then to also boost the pay of the blue collar people would compound something that you already don't agree with.",Normal,False,False,False,Negative,1
287,MS. WALKER,"well, they have to increase they's cost of labor, and what they charge the department of defense to make the repairs on these weapon systems will increase using they.",Normal,False,False,False,Positive,3
288,CHAIRMAN FRIEDMAN,"well, may chairman friedman suggest that we have a work group to consider implementation of this proposal, and when a work group to consider implementation of this proposal's work is done, its work will be brought back here, and its work would, chairman friedman think, be the time to revisit the issue as far as the fws is concerned.",Normal,False,True,False,Negative,1
289,CHAIRMAN FRIEDMAN,anything else on this?.,Interrogative-affirmation,False,False,False,Neutral,2
290,CHAIRMAN FRIEDMAN,any other business that we need to address this morning?.,Interrogative-affirmation,False,False,False,Neutral,2
291,CHAIRMAN FRIEDMAN,"if not, how do people feel about adjourning?.",Interrogative-unknown,True,False,False,Neutral,2
292,MR. PHELPS,so moved.,Normal,False,False,False,Positive,3
293,MR. ALLEN,and seconded.,Normal,False,False,False,Neutral,2
294,CHAIRMAN FRIEDMAN,okay.,Normal,False,False,False,Positive,3
295,CHAIRMAN FRIEDMAN,"hearing no objection, we are adjourned, and we will have a work group meeting in -- let's make 's six minutes or seven minutes.",Task Assigned,True,False,False,Negative,1
296,CHAIRMAN FRIEDMAN,--.,Normal,False,False,False,Neutral,2
